<?xml version="1.0" encoding="UTF-8"?>
<dataroot xmlns:od="urn:schemas-microsoft-com:officedata" xmlns:xsi="http://www.w3.org/2001/XMLSchema-instance"  xsi:noNamespaceSchemaLocation="Akteure.xsd" generated="2023-05-21T18:32:49">
<Akteure>
<ID>1</ID>
<Name>Joseph Schreyvogel</Name>
<Lebensdaten>1768-1832</Lebensdaten>
<Beruf>&lt;div&gt;Autor&lt;/div&gt;</Beruf>
<Pseudonyme>C. A. West; Karl August West; Thomas West; West</Pseudonyme>
<Sortiername>Schreyvogel, Joseph</Sortiername>
<Nachweis>Goed IX/2, 2; E 325</Nachweis>
</Akteure>
<Akteure>
<ID>2</ID>
<Name>Wenzel Tremler</Name>
<Lebensdaten>1770-1851</Lebensdaten>
<Beruf>&lt;div&gt;Autor, Herausgeber&lt;/div&gt;</Beruf>
<Pseudonyme>Lembert; J. W. Lembert</Pseudonyme>
<Sortiername>Tremler, Wenzel</Sortiername>
<Nachweis>Goed IX, 29; H/B 161</Nachweis>
</Akteure>
<Akteure>
<ID>3</ID>
<Name>Johann Baptist Wallishauser</Name>
<Beruf>&lt;div&gt;Herausgeber, Drucker&lt;/div&gt;</Beruf>
<Sortiername>Wallishauser, Johann Baptist</Sortiername>
<Nachweis>DBI 2142</Nachweis>
</Akteure>
<Akteure>
<ID>4</ID>
<Name>Johann Heinrich Ramberg</Name>
<Lebensdaten>1763-1840</Lebensdaten>
<Beruf>&lt;div&gt;Graphiker&lt;/div&gt;</Beruf>
<Sortiername>Ramberg, Johann Heinrich</Sortiername>
<Nachweis>T/B XXVII, 587</Nachweis>
</Akteure>
<Akteure>
<ID>5</ID>
<Name>Eduard Ender</Name>
<Lebensdaten>1822-1883</Lebensdaten>
<Beruf>&lt;div&gt;Graphiker&lt;/div&gt;</Beruf>
<Sortiername>Ender, Eduard</Sortiername>
<Nachweis>T/B X, 515</Nachweis>
</Akteure>
</dataroot>
